### ISSUE TITLE
3wayハンドシェイク 失敗

### ISSUE THREAD

**Issue by hitto-hub** [hitto-hub/keepalived-lb#1]
- 実行したパケットキャプチャ
`tcpdump -i eth0 -nn host 192.168.10.9 or 192.168.10.100 or 192.168.10.11 or 192.168.10.12`
- 結果
```
client
17:45:55.480479 IP 192.168.10.9.44924 > 192.168.10.100.80: Flags [S], seq 1877380676, win 64240, options [mss 1460,sackOK,TS val 659357303 ecr 0,nop,wscale 7], length 0
17:45:55.480734 IP 192.168.10.11.80 > 192.168.10.9.44924: Flags [S.], seq 92494250, ack 1877380677, win 65160, options [mss 1460,sackOK,TS val 1234741506 ecr 659357303,nop,wscale 7], length 0
17:45:55.480768 IP 192.168.10.9.44924 > 192.168.10.11.80: Flags [R], seq 1877380677, win 0, length 0
keepalived
17:45:55.480564 IP 192.168.10.9.44924 > 192.168.10.100.80: Flags [S], seq 1877380676, win 64240, options [mss 1460,sackOK,TS val 659357303 ecr 0,nop,wscale 7], length 0
17:45:55.480608 IP 192.168.10.9.44924 > 192.168.10.11.80: Flags [S], seq 1877380676, win 64240, options [mss 1460,sackOK,TS val 659357303 ecr 0,nop,wscale 7], length 0
```
ackがlbを飛ばしているので失敗している
